{
  "id": "maximalist",
  "label": "Maximalist",
  "description": "Full-coverage, all-over textile-scale repetition — every inch carries pattern, no single hero dominates.",
  "compatibleLayouts": ["halfDrop", "brick", "densePremium", "stripe"],
  "hierarchyPreset": "allOverTextile",
  "densityRange": { "min": 0.4, "max": 0.6 },
  "negativeSpaceRange": { "min": 0, "max": 0.1 },
  "compatibleFlowProfiles": ["calm", "directional"],
  "compatibleRhythmProfiles": ["regular", "organic"],
  "rules": [
    { "id": "maximalist-node-budget-risk", "description": "Maximalist + a high-detail motif category can exceed the SVG Engine's hard node budget — verify with the Design Quality loop before shipping (same caution as 'dense').", "severity": "warning" }
  ]
}
