{
  "id": "editorial",
  "label": "Editorial",
  "description": "A clear, single dominant hero motif with generous surrounding room — a magazine-cover-style focal composition.",
  "compatibleLayouts": ["bouquet", "heroScatter", "heroFlow"],
  "hierarchyPreset": "heroFocus",
  "densityRange": { "min": 0.45, "max": 0.6 },
  "negativeSpaceRange": { "min": 0.1, "max": 0.3 },
  "compatibleFlowProfiles": ["directional", "dynamic"],
  "compatibleRhythmProfiles": ["organic", "syncopated"],
  "rules": [
    { "id": "editorial-hero-dominance", "description": "The hero motif's heroScale should be visibly larger than secondary/filler scales, or the composition reads as balanced rather than editorial.", "severity": "error" }
  ]
}
